<xs:schema attributeFormDefault="unqualified" elementFormDefault="qualified"
    xmlns:xs="http://www.w3.org/2001/XMLSchema">
    <xs:element name="list">
        <xs:complexType>
            <xs:sequence>
                <xs:element name="author" minOccurs="0" maxOccurs="unbounded">
                    <xs:complexType>
                        <xs:sequence>
                            <xs:element name="book" minOccurs="0" maxOccurs="unbounded">
                                <xs:complexType>
                                    <xs:all minOccurs="1" maxOccurs="1">
                                        <xs:element type="xs:string" name="name" />
                                        <xs:element type="xs:double" name="price" />
                                        <xs:element name="genre">
                                            <xs:simpleType>
                                                <xs:restriction base="xs:string">
                                                    <xs:enumeration value="horror" />
                                                    <xs:enumeration value="scifi" />
                                                    <xs:enumeration value="adventure" />
                                                    <xs:enumeration value="comedy" />
                                                    <xs:enumeration value="drama" />
                                                    <xs:enumeration value="biography" />
                                                </xs:restriction>
                                            </xs:simpleType>
                                        </xs:element>
                                    </xs:all>
                                    <xs:attribute type="xs:ID" name="id" use="required" />
                                </xs:complexType>
                            </xs:element>
                        </xs:sequence>
                        <xs:attribute type="xs:string" name="firstname" use="required" />
                        <xs:attribute type="xs:string" name="lastname" use="required" />
                        <xs:attribute type="xs:ID" name="id" use="required" />
                    </xs:complexType>
                </xs:element>
            </xs:sequence>
        </xs:complexType>
    </xs:element>
</xs:schema>